{
  "matchup": {
    "homeTeamId": "b3b6c2a0-6e2a-4c1e-9d3a-1f2e3d4c5b6a",
    "awayTeamId": "1a2b3c4d-5e6f-4a7b-8c9d-0e1f2a3b4c5d",
    "season": 2025,
    "isNeutralSite": true
  },
  "predictions": [
    {
      "id": "7f6e5d4c-3b2a-4190-8b7c-6a5f4e3d2c1b",
      "method": "ELO",
      "predictedWinnerTeamId": "b3b6c2a0-6e2a-4c1e-9d3a-1f2e3d4c5b6a",
      "confidence": 0.72,
      "generatedAt": "2025-08-29T12:00:00Z"
    }
  ],
  "simulations": [
    {
      "id": "5e6f7081-92a3-4bb4-8c5d-6e7f8091a2b3",
      "method": "MONTE_CARLO",
      "trials": 10000,
      "homeWinProbability": 0.71,
      "awayWinProbability": 0.29,
      "simulatedAt": "2025-08-29T12:00:00Z"
    }
  ],
  "aggregate": {
    "id": "2b3c4d5e-6f70-4819-9a0b-1c2d3e4f5061",
    "aggregationStrategy": "AVERAGE",
    "contributingResultIds": [
      "7f6e5d4c-3b2a-4190-8b7c-6a5f4e3d2c1b"
    ],
    "predictedWinnerTeamId": "b3b6c2a0-6e2a-4c1e-9d3a-1f2e3d4c5b6a",
    "confidence": 0.72,
    "generatedAt": "2025-08-29T12:00:00Z"
  }
}
